{
  "schema_version": "1.0.0",
  "language": "typescript",
  "workflow": "explicit_audit_repair",
  "production_profiles": ["strict"],
  "supported_overlays": ["base", "svelte", "sveltekit"],
  "rules": [
    {
      "id": "TS-READ-001",
      "title": "Keep design direct, proportionate, and legible",
      "category": "human_quality",
      "overlay": "base",
      "maturity": "approved",
      "decidability": "partially_decidable",
      "dimensions": ["architecture", "human_quality"],
      "applicability": "All in-scope TypeScript source and tests.",
      "strict_enforcement": "required",
      "requirement": "Code must use the simplest design that preserves its governing invariants. Every abstraction, wrapper, branch, generic, and indirection must own a present responsibility.",
      "rationale": "Speculative or pass-through machinery hides intent, enlarges the change surface, and makes locally simple behavior harder to verify.",
      "provenance": [
        {
          "authority": "Google TypeScript Style Guide",
          "maturity": "independent",
          "revision": "live-guide-reviewed-2026-08-26",
          "url": "https://google.github.io/styleguide/tsguide.html",
          "upstream_rules": ["clarity", "prefer simpler constructs"]
        }
      ],
      "audit_procedure": [
        "Trace each abstraction through its callers, invariants, and present change pressure.",
        "Require a named policy, boundary, lifecycle, substitution, or evidence role for every non-trivial layer.",
        "Report pass-through and speculative structure only when removing it preserves a clearer contract; do not use size or style preference as the finding."
      ],
      "mechanical_enforcement": [
        {
          "evidence_class": "source_review",
          "check": "caller and responsibility trace",
          "role": "evidence",
          "caveat": "A detector or complexity threshold cannot decide whether an abstraction owns real policy."
        }
      ],
      "remediation": {
        "default_authority": "review_required",
        "action_overrides": [],
        "guidance": "Remove or flatten machinery only after checking callers, exported contracts, error behavior, and lifecycle ownership."
      },
      "deviation": {
        "allowed": true,
        "required_evidence": ["named responsibility", "why a simpler shape is insufficient", "focused preservation evidence"]
      },
      "completion_evidence": ["abstraction responsibility ledger", "final-diff readability review", "focused behavior preservation"]
    },
    {
      "id": "TS-EVIDENCE-001",
      "title": "Preserve type evidence",
      "category": "type_safety",
      "overlay": "base",
      "maturity": "approved",
      "decidability": "partially_decidable",
      "dimensions": ["correctness_assurance", "architecture", "human_quality"],
      "applicability": "Assertions, generics, casts, non-null assertions, and boundary adapters.",
      "strict_enforcement": "mandatory",
      "requirement": "Every claimed type must be supported by local static or runtime evidence. Chained assertions, widening through unknown, unjustified non-null assertions, and unconstrained generic escape hatches are prohibited.",
      "rationale": "Assertions suppress the compiler without proving the runtime fact. Laundered uncertainty turns type checking into documentation rather than assurance.",
      "provenance": [
        {
          "authority": "Google TypeScript Style Guide",
          "maturity": "independent",
          "revision": "live-guide-reviewed-2026-08-26",
          "url": "https://google.github.io/styleguide/tsguide.html",
          "upstream_rules": ["type assertions", "non-null assertions"]
        },
        {
          "authority": "anti-slop",
          "maturity": "experimental",
          "revision": "6d538555cb151d4121ed51a27db81890eacf8ae9",
          "url": "https://github.com/dmmulroy/anti-slop/tree/6d538555cb151d4121ed51a27db81890eacf8ae9",
          "upstream_rules": ["unsafe type assertions"]
        }
      ],
      "audit_procedure": [
        "Inventory casts, non-null assertions, assertion functions, and generic defaults or constraints that can erase evidence.",
        "For each claim, identify the local narrowing, parser, invariant, or construction path that proves it.",
        "Report only claims whose evidence is absent or weaker than the asserted type; do not replace useful unknown with any."
      ],
      "mechanical_enforcement": [
        {
          "evidence_class": "lint",
          "check": "repository-owned rules for unnecessary, unsafe, and non-null assertions",
          "role": "candidate",
          "caveat": "Lint availability and configuration are repository evidence; source review decides whether the assertion is justified."
        }
      ],
      "remediation": {
        "default_authority": "review_required",
        "action_overrides": [],
        "guidance": "Replace the assertion with narrowing, validation, a stronger generic constraint, or a construction invariant proven at the use site."
      },
      "deviation": {
        "allowed": true,
        "required_evidence": ["exact claimed runtime fact", "why local proof cannot be expressed", "boundary or invariant owner"]
      },
      "completion_evidence": ["assertion inventory", "local evidence for retained claims", "type-check evidence when available"]
    },
    {
      "id": "TS-BOUNDARY-001",
      "title": "Narrow external uncertainty at the boundary",
      "category": "boundary_safety",
      "overlay": "base",
      "maturity": "approved",
      "decidability": "partially_decidable",
      "dimensions": ["correctness_assurance", "architecture"],
      "applicability": "Network, storage, environment, message, catch, parser, and interoperability boundaries.",
      "strict_enforcement": "mandatory",
      "requirement": "Externally supplied values must enter as unknown or an equally honest boundary type and be validated before domain use. Record checks must distinguish named-field objects from null and arrays when the domain requires a record.",
      "rationale": "Static annotations do not validate runtime input. Boundary parsing prevents malformed data and accidental array acceptance from contaminating trusted domain code.",
      "provenance": [
        {
          "authority": "TypeScript Handbook",
          "maturity": "official",
          "revision": "live-handbook-reviewed-2026-08-26",
          "url": "https://www.typescriptlang.org/docs/handbook/2/narrowing.html",
          "upstream_rules": ["narrowing", "unknown"]
        },
        {
          "authority": "ECMAScript specification",
          "maturity": "official",
          "revision": "ECMA-262-2026-draft-reviewed-2026-08-26",
          "url": "https://tc39.es/ecma262/multipage/abstract-operations.html#sec-isarray",
          "upstream_rules": ["IsArray"]
        }
      ],
      "audit_procedure": [
        "Inventory external inputs and trace them to the first trusted domain operation.",
        "Verify structural and semantic validation occurs before use and does not rely on an assertion-only parser.",
        "Check object guards reject null and arrays whenever the intended domain shape is a named-field record."
      ],
      "mechanical_enforcement": [
        {
          "evidence_class": "source_review",
          "check": "boundary-to-domain value trace",
          "role": "enforce",
          "caveat": "Compiler success cannot establish the shape of runtime data."
        }
      ],
      "remediation": {
        "default_authority": "review_required",
        "action_overrides": [],
        "guidance": "Add the narrowest parser or guard at the owning boundary, preserve useful diagnostics, and keep validated domain types downstream."
      },
      "deviation": {
        "allowed": true,
        "required_evidence": ["trusted producer contract", "integrity mechanism", "failure behavior", "recheck trigger"]
      },
      "completion_evidence": ["external-boundary inventory", "validation-path review", "malformed-input preservation evidence"]
    },
    {
      "id": "TS-ASYNC-001",
      "title": "Make asynchronous ownership and lifecycle explicit",
      "category": "async_correctness",
      "overlay": "base",
      "maturity": "approved",
      "decidability": "partially_decidable",
      "dimensions": ["correctness_assurance", "architecture"],
      "applicability": "Promises, tasks, callbacks, streams, timers, subscriptions, and cancellation.",
      "strict_enforcement": "mandatory",
      "requirement": "Asynchronous work must be awaited, returned, deliberately detached with observed failure, or owned by a cancellation and cleanup lifecycle. Shutdown and supersession must not leave unowned work or resources.",
      "rationale": "Floating work loses failures, races teardown, and makes observable behavior depend on process timing rather than an explicit owner.",
      "provenance": [
        {
          "authority": "typescript-eslint",
          "maturity": "independent",
          "revision": "live-rule-reviewed-2026-08-26",
          "url": "https://typescript-eslint.io/rules/no-floating-promises/",
          "upstream_rules": ["no-floating-promises"]
        }
      ],
      "audit_procedure": [
        "Trace every spawned promise, timer, subscription, stream, and callback to its owner.",
        "Verify failures are observed and deliberate detachment is visible rather than accidental.",
        "Inspect cancellation, supersession, component or service teardown, and shutdown for cleanup races and stale writes."
      ],
      "mechanical_enforcement": [
        {
          "evidence_class": "lint",
          "check": "repository-owned no-floating-promises equivalent",
          "role": "evidence",
          "caveat": "A lint does not prove cleanup, cancellation, or lifecycle ownership and may be unavailable."
        }
      ],